{
  "schemaVersion": "0.1.0",
  "id": "demo-room",
  "name": "Synthetic demo room (fixture)",
  "revision": 0,
  "units": "meters",
  "upAxis": "Y",
  "source": {
    "imageUrl": "/api/projects/demo-room/blueprint",
    "imageWidth": 300,
    "imageHeight": 250,
    "mimeType": "image/png",
    "synthetic": true,
    "calibration": {
      "pointA": [50, 50],
      "pointB": [150, 50],
      "distanceMeters": 2.0,
      "metersPerPixel": 0.02
    }
  },
  "reconstruction": {
    "parser": { "name": "fixture", "version": "0.1.0", "checkpoint": null, "license": null },
    "createdAt": "2026-10-08T00:00:00Z",
    "defaults": { "wallHeight": 2.7, "wallThickness": 0.12 },
    "warnings": ["Synthetic contract fixture. Not a reconstruction result."]
  },
  "rooms": [
    {
      "id": "room-1",
      "name": "Room",
      "polygon": [[1.0, 1.0], [5.0, 1.0], [5.0, 4.0], [1.0, 4.0]],
      "height": 2.7,
      "provenance": {
        "origin": "generated", "confidence": null, "source": "fixture", "userEdited": false,
        "fieldOrigins": { "height": "inferred" },
        "notes": ["4 m x 3 m synthetic room; height is the default assumption."]
      }
    }
  ],
  "walls": [
    {
      "id": "wall-n", "start": [1.0, 1.0], "end": [5.0, 1.0], "height": 2.7, "thickness": 0.12,
      "provenance": { "origin": "generated", "confidence": null, "source": "fixture", "userEdited": false, "fieldOrigins": { "height": "inferred", "thickness": "inferred" }, "notes": [] }
    },
    {
      "id": "wall-e", "start": [5.0, 1.0], "end": [5.0, 4.0], "height": 2.7, "thickness": 0.12,
      "provenance": { "origin": "generated", "confidence": null, "source": "fixture", "userEdited": false, "fieldOrigins": { "height": "inferred", "thickness": "inferred" }, "notes": [] }
    },
    {
      "id": "wall-s", "start": [5.0, 4.0], "end": [1.0, 4.0], "height": 2.7, "thickness": 0.12,
      "provenance": { "origin": "generated", "confidence": null, "source": "fixture", "userEdited": false, "fieldOrigins": { "height": "inferred", "thickness": "inferred" }, "notes": [] }
    },
    {
      "id": "wall-w", "start": [1.0, 4.0], "end": [1.0, 1.0], "height": 2.7, "thickness": 0.12,
      "provenance": { "origin": "generated", "confidence": null, "source": "fixture", "userEdited": false, "fieldOrigins": { "height": "inferred", "thickness": "inferred" }, "notes": [] }
    }
  ],
  "openings": [
    {
      "id": "door-1", "type": "door", "wallId": "wall-s", "offset": 1.0, "width": 0.9, "height": 2.1, "bottom": 0,
      "provenance": { "origin": "generated", "confidence": null, "source": "fixture", "userEdited": false, "fieldOrigins": { "height": "inferred" }, "notes": [] }
    },
    {
      "id": "window-1", "type": "window", "wallId": "wall-n", "offset": 1.5, "width": 1.2, "height": 1.2, "bottom": 0.9,
      "provenance": { "origin": "generated", "confidence": null, "source": "fixture", "userEdited": false, "fieldOrigins": { "height": "inferred", "bottom": "inferred" }, "notes": [] }
    }
  ],
  "objects": [
    {
      "id": "obj-table-1", "name": "Table", "category": "table", "componentId": "table.basic",
      "position": [3.0, 0, 2.5], "rotationY": 0, "dimensions": [1.2, 0.75, 0.8],
      "provenance": { "origin": "generated", "confidence": null, "source": "fixture", "userEdited": false, "fieldOrigins": {}, "notes": [] }
    }
  ]
}
